{
  "entity_type": "priority_assessment",
  "schema_version": "1.0.0",
  "priority_assessment_id": "PRIO-TEST-005-B",
  "priority_assessment_version": "1.0.0",
  "opportunity_id": "OPP-B04-QUAL-002",
  "impact": "HIGH",
  "evidence_strength": "MEDIUM",
  "feasibility": "HIGH",
  "urgency": "MEDIUM",
  "dependency": "NONE",
  "strategic_relevance": "HIGH",
  "impact_basis": "High citation impact.",
  "evidence_strength_basis": "Moderate evidence from T1.",
  "feasibility_basis": "High feasibility.",
  "urgency_basis": "Medium urgency.",
  "dependency_basis": "Independent opportunity.",
  "strategic_relevance_basis": "Aligned with M08 objectives.",
  "priority_recommendation": "P1",
  "recommendation_source": "RULE_ENGINE",
  "recommendation_rationale": "High Priority Candidate: High impact supported by verified evidence and high/medium feasibility.",
  "assessment_scope": "GLOBAL",
  "assessment_status": "RECOMMENDED",
  "assessment_notes": "",
  "evidence_refs": [],
  "created_at": "2026-10-03T10:04:32.843Z",
  "updated_at": null,
  "created_by": "SYSTEM",
  "reviewed_by": null,
  "is_immutable": false,
  "metadata": {}
}