{
  "entity_type": "priority_assessment",
  "schema_version": "1.0.0",
  "priority_assessment_id": "PRIO-B06-001",
  "priority_assessment_version": "1.0.0",
  "opportunity_id": "OPP-B06-001",
  "impact": "HIGH",
  "evidence_strength": "HIGH",
  "feasibility": "HIGH",
  "urgency": "HIGH",
  "dependency": "NONE",
  "strategic_relevance": "HIGH",
  "impact_basis": "High visibility impact.",
  "evidence_strength_basis": "Empirical T1 evidence.",
  "feasibility_basis": "Local schema update.",
  "urgency_basis": "Immediate baseline need.",
  "dependency_basis": "Zero external dependencies.",
  "strategic_relevance_basis": "Foundational entity identity.",
  "priority_recommendation": "P0",
  "recommendation_source": "RULE_ENGINE",
  "recommendation_rationale": "Critical / Prerequisite: Opportunity represents a blocking dependency or high-urgency strategic alignment with verified evidence.",
  "assessment_scope": "GLOBAL",
  "assessment_status": "RECOMMENDED",
  "assessment_notes": "",
  "evidence_refs": [
    "EVD-VIS-T1-CHATGPT-P01"
  ],
  "created_at": "2026-10-03T10:04:45.452Z",
  "updated_at": null,
  "created_by": "SYSTEM",
  "reviewed_by": null,
  "is_immutable": false,
  "metadata": {}
}