{
  "entity_type": "priority_assessment",
  "schema_version": "1.0.0",
  "priority_assessment_id": "PRIO-TEST-001",
  "priority_assessment_version": "1.0.0",
  "opportunity_id": "OPP-B04-QUAL-001",
  "impact": "HIGH",
  "evidence_strength": "HIGH",
  "feasibility": "HIGH",
  "urgency": "HIGH",
  "dependency": "BLOCKING",
  "strategic_relevance": "HIGH",
  "impact_basis": "Directly impacts brand entity discoverability across all 3 AI search environments.",
  "evidence_strength_basis": "Supported by 60 empirical observations across 20 canonical prompts in T1 Reference Run.",
  "feasibility_basis": "JSON-LD schema implementation requires low architectural friction.",
  "urgency_basis": "Entity confusion persists across current production queries.",
  "dependency_basis": "Prerequisite for citation acquisition and accurate context synthesis.",
  "strategic_relevance_basis": "Core objective of Module 08 Visibility Operating System.",
  "priority_recommendation": "P0",
  "recommendation_source": "RULE_ENGINE",
  "recommendation_rationale": "Critical / Prerequisite: Opportunity represents a blocking dependency or high-urgency strategic alignment with verified evidence.",
  "assessment_scope": "GLOBAL",
  "assessment_status": "RECOMMENDED",
  "assessment_notes": "",
  "evidence_refs": [],
  "created_at": "2026-10-03T10:04:32.539Z",
  "updated_at": null,
  "created_by": "SYSTEM",
  "reviewed_by": null,
  "is_immutable": false,
  "metadata": {}
}