{
  "entity_type": "priority_assessment",
  "schema_version": "1.0.0",
  "priority_assessment_id": "PRIO-TEST-011",
  "priority_assessment_version": "1.1.0",
  "opportunity_id": "OPP-B04-QUAL-001",
  "impact": "MEDIUM",
  "evidence_strength": "MEDIUM",
  "feasibility": "HIGH",
  "urgency": "HIGH",
  "dependency": "NONE",
  "strategic_relevance": "MEDIUM",
  "impact_basis": "Initial basis.",
  "evidence_strength_basis": "Initial basis.",
  "feasibility_basis": "Initial basis.",
  "urgency_basis": "New production telemetry reveals urgent priority.",
  "dependency_basis": "Initial basis.",
  "strategic_relevance_basis": "Initial basis.",
  "priority_recommendation": "P2",
  "recommendation_source": "RULE_ENGINE",
  "recommendation_rationale": "Normal Priority: Moderate impact or high-impact constrained by feasibility.",
  "assessment_scope": "GLOBAL",
  "assessment_status": "RECOMMENDED",
  "assessment_notes": "",
  "evidence_refs": [],
  "created_at": "2026-10-03T10:04:33.968Z",
  "updated_at": "2026-10-03T10:04:34.121Z",
  "created_by": "SYSTEM",
  "reviewed_by": "OPERATOR",
  "is_immutable": false,
  "metadata": {}
}