{
  "entity_type": "priority_assessment",
  "schema_version": "1.0.0",
  "priority_assessment_id": "PRIO-E2E-002",
  "priority_assessment_version": "1.0.0",
  "opportunity_id": "OPP-E2E-002",
  "impact": "LOW",
  "evidence_strength": "LOW",
  "feasibility": "LOW",
  "urgency": "LOW",
  "dependency": "NONE",
  "strategic_relevance": "LOW",
  "impact_basis": "Unproven experimental benefit.",
  "evidence_strength_basis": "Preliminary hypotheses only.",
  "feasibility_basis": "Complex microdata parser requirements.",
  "urgency_basis": "Non-urgent.",
  "dependency_basis": "None.",
  "strategic_relevance_basis": "Peripheral test.",
  "priority_recommendation": "P3",
  "recommendation_source": "RULE_ENGINE",
  "recommendation_rationale": "Defer Candidate: Low urgency, constrained feasibility, or low immediate impact.",
  "assessment_scope": "GLOBAL",
  "assessment_status": "RECOMMENDED",
  "assessment_notes": "",
  "evidence_refs": [
    "EVD-VIS-T1-CHATGPT-P01"
  ],
  "created_at": "2026-10-03T10:08:15.475Z",
  "updated_at": null,
  "created_by": "SYSTEM",
  "reviewed_by": null,
  "is_immutable": false,
  "metadata": {}
}