{
  "entity_type": "priority_assessment",
  "schema_version": "1.0.0",
  "priority_assessment_id": "PRIO-TEST-005-A",
  "priority_assessment_version": "1.0.0",
  "opportunity_id": "OPP-B04-QUAL-001",
  "impact": "HIGH",
  "evidence_strength": "HIGH",
  "feasibility": "HIGH",
  "urgency": "MEDIUM",
  "dependency": "NONE",
  "strategic_relevance": "HIGH",
  "impact_basis": "High impact on visibility.",
  "evidence_strength_basis": "Verified across all T1 runs.",
  "feasibility_basis": "Standard implementation effort.",
  "urgency_basis": "Medium near-term urgency.",
  "dependency_basis": "No blocking dependencies.",
  "strategic_relevance_basis": "High strategic relevance.",
  "priority_recommendation": "P1",
  "recommendation_source": "RULE_ENGINE",
  "recommendation_rationale": "High Priority Candidate: High impact supported by verified evidence and high/medium feasibility.",
  "assessment_scope": "GLOBAL",
  "assessment_status": "RECOMMENDED",
  "assessment_notes": "",
  "evidence_refs": [],
  "created_at": "2026-10-03T10:04:32.674Z",
  "updated_at": null,
  "created_by": "SYSTEM",
  "reviewed_by": null,
  "is_immutable": false,
  "metadata": {}
}