{
  "entity_type": "priority_assessment",
  "schema_version": "1.0.0",
  "priority_assessment_id": "PRIO-TEST-007-PAS",
  "priority_assessment_version": "1.0.0",
  "opportunity_id": "OPP-B04-QUAL-002",
  "impact": "MEDIUM",
  "evidence_strength": "HIGH",
  "feasibility": "HIGH",
  "urgency": "MEDIUM",
  "dependency": "NONE",
  "strategic_relevance": "MEDIUM",
  "impact_basis": "Incremental citation impact.",
  "evidence_strength_basis": "Sufficient evidence available.",
  "feasibility_basis": "Quick implementation.",
  "urgency_basis": "Standard urgency.",
  "dependency_basis": "None.",
  "strategic_relevance_basis": "Moderate.",
  "priority_recommendation": "P2",
  "recommendation_source": "RULE_ENGINE",
  "recommendation_rationale": "Normal Priority: Moderate impact or high-impact constrained by feasibility.",
  "assessment_scope": "GLOBAL",
  "assessment_status": "RECOMMENDED",
  "assessment_notes": "",
  "evidence_refs": [],
  "created_at": "2026-10-03T10:04:33.179Z",
  "updated_at": null,
  "created_by": "SYSTEM",
  "reviewed_by": null,
  "is_immutable": false,
  "metadata": {}
}