{
  "entity_type": "priority_assessment",
  "schema_version": "1.0.0",
  "priority_assessment_id": "PRIO-B05-001",
  "priority_assessment_version": "1.0.0",
  "opportunity_id": "OPP-B05-QUAL-001",
  "impact": "HIGH",
  "evidence_strength": "HIGH",
  "feasibility": "HIGH",
  "urgency": "HIGH",
  "dependency": "NONE",
  "strategic_relevance": "HIGH",
  "impact_basis": "High visibility impact on primary entity queries.",
  "evidence_strength_basis": "Direct empirical observation in T1 dataset.",
  "feasibility_basis": "Local schema markup updates require standard static deployment.",
  "urgency_basis": "Core identity prerequisite for subsequent experiments.",
  "dependency_basis": "Zero external dependencies.",
  "strategic_relevance_basis": "Foundational entity discoverability.",
  "priority_recommendation": "P0",
  "recommendation_source": "RULE_ENGINE",
  "recommendation_rationale": "Critical / Prerequisite: Opportunity represents a blocking dependency or high-urgency strategic alignment with verified evidence.",
  "assessment_scope": "GLOBAL",
  "assessment_status": "RECOMMENDED",
  "assessment_notes": "",
  "evidence_refs": [
    "EVD-VIS-T1-CHATGPT-P01"
  ],
  "created_at": "2026-10-03T10:04:37.263Z",
  "updated_at": null,
  "created_by": "SYSTEM",
  "reviewed_by": null,
  "is_immutable": false,
  "metadata": {}
}